"slug","name","description","affiliateUrl","factoringType","feeMin","feeMax","minAmount","maxAmount","speedDays","onlineComplete","features","pros","cons","overallRating","rankPosition","establishedYear","targetIndustries"
"factoring-north","ファクタリングノース","北海道拠点のファクタリング会社。地元密着の対応。","https://px.a8.net/svt/ejp?a8mat=FACTORINGNORTH","2社間・3社間","3","15","300000","50000000","1","TRUE","北海道拠点、地域密着、即日入金、個人事業主OK、対面相談可","対応が迅速、審査が柔軟、全国対応","知名度がやや低い、手数料は個別査定","3.4","185","2018","建設業、運送業、農業、水産業、サービス業"
"sms-financial","SMSフィナンシャル","ファイナンシャルサービス。ファクタリング対応。","https://px.a8.net/svt/ejp?a8mat=SMSFINANCIAL","2社間・3社間","3","15","300000","50000000","1","TRUE","即日入金可能、オンライン対応、個人事業主OK、全国対応、柔軟な審査","対応が迅速、審査が柔軟、全国対応","知名度がやや低い、手数料は個別査定","3.3","186","2018","建設業、運送業、製造業、IT・Web、サービス業"
"taihei-fs","太平フィナンシャルサービス","ファクタリング・リースのファイナンスサービス。","https://px.a8.net/svt/ejp?a8mat=TAIHEIFS","3社間","1","8","300000","50000000","3","TRUE","リース対応、ファクタリング、法人向け、全国対応、安定経営","対応が迅速、審査が柔軟、全国対応","知名度がやや低い、手数料は個別査定","3.4","187","2000","建設業、運送業、製造業、IT・Web、サービス業"
"factbank","ファクトバンク","ファクタリングの比較・マッチングサービス。最適な会社を紹介。","https://px.a8.net/svt/ejp?a8mat=FACTBANK","2社間・3社間","2","15","300000","50000000","1","TRUE","比較サービス、マッチング、複数社提案、無料相談、全国対応","対応が迅速、審査が柔軟、全国対応","知名度がやや低い、手数料は個別査定","3.4","188","2018","建設業、運送業、製造業、IT・Web、サービス業"
"denshi-hayabarai","電子請求書早払い","電子請求書の早払いサービス。オンライン完結のファクタリング。","https://px.a8.net/svt/ejp?a8mat=DENSHIHAYABARAI","2社間・3社間","1","8","300000","50000000","1","TRUE","電子請求書対応、オンライン完結、即日入金、法人向け、テクノロジー活用","対応が迅速、審査が柔軟、全国対応","知名度がやや低い、手数料は個別査定","3.5","189","2020","建設業、運送業、製造業、IT・Web、サービス業"
"localworks-payment","ローカルワークスペイメント","地域密着型のファクタリングサービス。建設業界に強い。","https://px.a8.net/svt/ejp?a8mat=LOCALWORKSPAYMENT","2社間・3社間","3","15","300000","50000000","1","TRUE","地域密着、建設業界に強い、即日入金、個人事業主OK、柔軟な審査","対応が迅速、審査が柔軟、全国対応","知名度がやや低い、手数料は個別査定","3.3","190","2018","建設業、運送業"
"tranzax","Tranzax","電子記録債権を活用したファクタリングサービス。","https://px.a8.net/svt/ejp?a8mat=TRANZAX","3社間","1","5","300000","50000000","3","TRUE","電子記録債権、テクノロジー活用、法人向け、全国対応、低手数料","対応が迅速、審査が柔軟、全国対応","知名度がやや低い、手数料は個別査定","3.5","191","2016","建設業、運送業、製造業、IT・Web、サービス業"
"growrize","グローライズ","ファクタリング・資金調達サービス。成長企業をサポート。","https://px.a8.net/svt/ejp?a8mat=GROWRIZE","2社間・3社間","3","15","300000","50000000","1","TRUE","即日入金可能、オンライン対応、個人事業主OK、全国対応、柔軟な審査","対応が迅速、審査が柔軟、全国対応","知名度がやや低い、手数料は個別査定","3.3","192","2018","建設業、運送業、製造業、IT・Web、サービス業"
"ryfety","ライフティ","ファクタリングサービス。個人事業主・法人向け資金調達。","https://px.a8.net/svt/ejp?a8mat=RYFETY","2社間・3社間","3","15","300000","50000000","1","TRUE","即日入金可能、オンライン対応、個人事業主OK、全国対応、柔軟な審査","対応が迅速、審査が柔軟、全国対応","知名度がやや低い、手数料は個別査定","3.3","193","2018","建設業、運送業、製造業、IT・Web、サービス業"
"faith-factoring","faith","ファクタリングサービス。中小企業の資金繰りをサポート。","https://px.a8.net/svt/ejp?a8mat=FAITHFACTORING","2社間・3社間","3","15","300000","50000000","1","TRUE","即日入金可能、オンライン対応、個人事業主OK、全国対応、柔軟な審査","対応が迅速、審査が柔軟、全国対応","知名度がやや低い、手数料は個別査定","3.3","194","2018","建設業、運送業、製造業、IT・Web、サービス業"
"finding-labo","ファインディングラボ","ファクタリング会社の比較・検索サービス。最適な業者を見つける。","https://px.a8.net/svt/ejp?a8mat=FINDINGLABO","2社間・3社間","2","15","300000","50000000","1","TRUE","比較サービス、無料相談、複数社提案、全国対応、個人事業主OK","対応が迅速、審査が柔軟、全国対応","知名度がやや低い、手数料は個別査定","3.4","195","2018","建設業、運送業、製造業、IT・Web、サービス業"
"fukuoka-bank-ep","福岡銀行アーリーペイメント","福岡銀行グループのファクタリングサービス。九州地域に強い。","https://px.a8.net/svt/ejp?a8mat=FUKUOKABANKEP","3社間","1","5","300000","50000000","3","TRUE","福岡銀行グループ、九州に強い、法人向け、大手金融機関、安心のサービス","対応が迅速、審査が柔軟、全国対応","知名度がやや低い、手数料は個別査定","3.5","196","2018","建設業、運送業、製造業、サービス業、小売業"
"regu-pay","レグペイ","ファクタリングサービス。法人向けの資金調達。","https://px.a8.net/svt/ejp?a8mat=REGUPAY","2社間・3社間","3","15","300000","50000000","1","TRUE","即日入金可能、オンライン対応、個人事業主OK、全国対応、柔軟な審査","対応が迅速、審査が柔軟、全国対応","知名度がやや低い、手数料は個別査定","3.3","197","2018","建設業、運送業、製造業、IT・Web、サービス業"
"ssk-factoring","SSKファクタリング","SSKホールディングスのファクタリングサービス。","https://px.a8.net/svt/ejp?a8mat=SSKFACTORING","2社間・3社間","3","15","300000","50000000","1","TRUE","即日入金可能、オンライン対応、個人事業主OK、全国対応、柔軟な審査","対応が迅速、審査が柔軟、全国対応","知名度がやや低い、手数料は個別査定","3.3","198","2018","建設業、運送業、製造業、IT・Web、サービス業"
"ebis-holdings","エビスホールディングス","ファクタリング・資金調達を提供するホールディングス会社。","https://px.a8.net/svt/ejp?a8mat=EBISHOLDINGS","2社間・3社間","3","15","300000","50000000","1","TRUE","即日入金可能、オンライン対応、個人事業主OK、全国対応、柔軟な審査","対応が迅速、審査が柔軟、全国対応","知名度がやや低い、手数料は個別査定","3.3","199","2018","建設業、運送業、製造業、IT・Web、サービス業"
"next-funding","NEXTFUNDING","ファクタリングサービス。次世代の資金調達を提供。","https://px.a8.net/svt/ejp?a8mat=NEXTFUNDING","2社間・3社間","3","15","300000","50000000","1","TRUE","即日入金、オンライン対応、個人事業主OK、全国対応、柔軟な審査","対応が迅速、審査が柔軟、全国対応","知名度がやや低い、手数料は個別査定","3.4","200","2018","建設業、運送業、製造業、IT・Web、サービス業"
"factoring-tokyo","ファクタリング東京","東京拠点のファクタリング会社。首都圏に強い。","https://px.a8.net/svt/ejp?a8mat=FACTORINGTOKYO","2社間・3社間","3","15","300000","50000000","1","TRUE","東京拠点、首都圏に強い、即日入金、個人事業主OK、対面相談可","対応が迅速、審査が柔軟、全国対応","知名度がやや低い、手数料は個別査定","3.4","201","2018","建設業、運送業、製造業、IT・Web、サービス業"
"make-move","メイク・ムーヴ","ファクタリングサービス。中小企業の資金調達をサポート。","https://px.a8.net/svt/ejp?a8mat=MAKEMOVE","2社間・3社間","3","15","300000","50000000","1","TRUE","即日入金可能、オンライン対応、個人事業主OK、全国対応、柔軟な審査","対応が迅速、審査が柔軟、全国対応","知名度がやや低い、手数料は個別査定","3.3","202","2018","建設業、運送業、製造業、IT・Web、サービス業"
"ntt-tc-lease","NTT・TCリース","NTTグループのリース・ファクタリングサービス。","https://px.a8.net/svt/ejp?a8mat=NTTTCLEASE","3社間","0.5","5","10000000","50000000","5","FALSE","NTTグループ、大手運営、法人向け、リース対応、全国対応","対応が迅速、審査が柔軟、全国対応","知名度がやや低い、手数料は個別査定","3.6","203","1985","建設業、運送業、製造業、IT・Web、サービス業"
"unity-factoring","UNITY","ファクタリングサービス。法人・個人事業主対応。","https://px.a8.net/svt/ejp?a8mat=UNITYFACTORING","2社間・3社間","3","15","300000","50000000","1","TRUE","即日入金可能、オンライン対応、個人事業主OK、全国対応、柔軟な審査","対応が迅速、審査が柔軟、全国対応","知名度がやや低い、手数料は個別査定","3.3","204","2018","建設業、運送業、製造業、IT・Web、サービス業"
"supporter-bank","サポートバンク","中小企業の資金調達をサポートするファクタリング会社。","https://px.a8.net/svt/ejp?a8mat=SUPPORTERBANK","2社間・3社間","3","15","300000","50000000","1","TRUE","即日入金可能、オンライン対応、個人事業主OK、全国対応、柔軟な審査","対応が迅速、審査が柔軟、全国対応","知名度がやや低い、手数料は個別査定","3.3","205","2018","建設業、運送業、製造業、IT・Web、サービス業"
"heartful-life","ハートフルライフ","ファクタリング・資金調達サービス。親身な対応が特長。","https://px.a8.net/svt/ejp?a8mat=HEARTFULLIFE","2社間・3社間","3","15","300000","50000000","1","TRUE","親身な対応、即日入金、個人事業主OK、全国対応、柔軟な審査","対応が迅速、審査が柔軟、全国対応","知名度がやや低い、手数料は個別査定","3.3","206","2018","建設業、運送業、製造業、IT・Web、サービス業"
"danbury","ダンバリコンサルティング","ファクタリング・コンサルティングサービス。","https://px.a8.net/svt/ejp?a8mat=DANBURY","2社間・3社間","3","15","300000","50000000","1","TRUE","即日入金可能、オンライン対応、個人事業主OK、全国対応、柔軟な審査","対応が迅速、審査が柔軟、全国対応","知名度がやや低い、手数料は個別査定","3.3","207","2018","建設業、運送業、製造業、IT・Web、サービス業"
"business-fund","ビジネスファンド","ファクタリング・事業資金調達サービス。中小企業向け。","https://px.a8.net/svt/ejp?a8mat=BUSINESSFUND","2社間・3社間","3","15","300000","50000000","1","TRUE","即日入金可能、オンライン対応、個人事業主OK、全国対応、柔軟な審査","対応が迅速、審査が柔軟、全国対応","知名度がやや低い、手数料は個別査定","3.3","208","2018","建設業、運送業、製造業、IT・Web、サービス業"
"belle-system","ベルシステム","ファクタリングサービス。法人向け資金調達。","https://px.a8.net/svt/ejp?a8mat=BELLESYSTEM","2社間・3社間","3","15","300000","50000000","1","TRUE","即日入金可能、オンライン対応、個人事業主OK、全国対応、柔軟な審査","対応が迅速、審査が柔軟、全国対応","知名度がやや低い、手数料は個別査定","3.3","209","2018","建設業、運送業、製造業、IT・Web、サービス業"
"zaimukaikei-shien","財務会計支援機構","ファクタリング・財務コンサルティングサービス。","https://px.a8.net/svt/ejp?a8mat=ZAIMUKAIKEISHIEN","2社間・3社間","3","15","300000","50000000","1","TRUE","財務コンサル、ファクタリング、経営支援、全国対応、法人向け","対応が迅速、審査が柔軟、全国対応","知名度がやや低い、手数料は個別査定","3.3","210","2018","建設業、運送業、製造業、IT・Web、サービス業"
"shoko-shoji","晶光商事","ファクタリング・金融サービス。中小企業の資金繰り支援。","https://px.a8.net/svt/ejp?a8mat=SHOKOSHOJI","2社間・3社間","3","15","300000","50000000","1","TRUE","即日入金可能、オンライン対応、個人事業主OK、全国対応、柔軟な審査","対応が迅速、審査が柔軟、全国対応","知名度がやや低い、手数料は個別査定","3.3","211","2005","建設業、運送業、製造業、IT・Web、サービス業"
"saison-medical","セゾン診療報酬ファクタリング","セゾンが提供する診療・介護・調剤報酬ファクタリング。","https://px.a8.net/svt/ejp?a8mat=SAISONMEDICAL","3社間","0.5","3","300000","50000000","5","TRUE","セゾングループ、医療機関向け、診療報酬対応、介護報酬対応、調剤報酬対応","対応が迅速、審査が柔軟、全国対応","知名度がやや低い、手数料は個別査定","3.6","212","2000","医療・介護"
"tick","ティック","ファクタリングサービス。迅速な対応で中小企業をサポート。","https://px.a8.net/svt/ejp?a8mat=TICK","2社間・3社間","3","15","300000","50000000","1","TRUE","即日入金可能、オンライン対応、個人事業主OK、全国対応、柔軟な審査","対応が迅速、審査が柔軟、全国対応","知名度がやや低い、手数料は個別査定","3.3","213","2018","建設業、運送業、製造業、IT・Web、サービス業"
"ms-quest","エムズクエスト","ファクタリング・資金調達コンサルティング。","https://px.a8.net/svt/ejp?a8mat=MSQUEST","2社間・3社間","3","15","300000","50000000","1","TRUE","即日入金可能、オンライン対応、個人事業主OK、全国対応、柔軟な審査","対応が迅速、審査が柔軟、全国対応","知名度がやや低い、手数料は個別査定","3.3","214","2018","建設業、運送業、製造業、IT・Web、サービス業"
"zen-confiance","善コンフィアンス","ファクタリングサービス。中小企業向け資金調達。","https://px.a8.net/svt/ejp?a8mat=ZENCONFIANCE","2社間・3社間","3","15","300000","50000000","1","TRUE","即日入金可能、オンライン対応、個人事業主OK、全国対応、柔軟な審査","対応が迅速、審査が柔軟、全国対応","知名度がやや低い、手数料は個別査定","3.3","215","2018","建設業、運送業、製造業、IT・Web、サービス業"
"shikinchotatsu-direct","資金調達ダイレクト","ファクタリングの直接取引サービス。中間マージンなし。","https://px.a8.net/svt/ejp?a8mat=SHIKINCHOTATSUDIRECT","2社間・3社間","2","12","300000","50000000","1","TRUE","直接取引、中間マージンなし、即日入金、個人事業主OK、全国対応","対応が迅速、審査が柔軟、全国対応","知名度がやや低い、手数料は個別査定","3.4","216","2018","建設業、運送業、製造業、IT・Web、サービス業"
"oj-factoring","オージェイ","ファクタリング・資金調達サービス。大阪拠点。","https://px.a8.net/svt/ejp?a8mat=OJFACTORING","2社間・3社間","3","15","300000","50000000","1","TRUE","大阪拠点、関西に強い、即日入金、個人事業主OK、対面相談可","対応が迅速、審査が柔軟、全国対応","知名度がやや低い、手数料は個別査定","3.3","217","2018","建設業、運送業、製造業、IT・Web、サービス業"
"healthee-one","HealtheeOne","医療・ヘルスケア業界向けファクタリングサービス。","https://px.a8.net/svt/ejp?a8mat=HEALTHEEONE","3社間","1","5","300000","50000000","3","TRUE","医療業界特化、ヘルスケア対応、法人向け、全国対応、専門スタッフ","対応が迅速、審査が柔軟、全国対応","知名度がやや低い、手数料は個別査定","3.4","218","2018","医療・介護"
"k-support","Kサポート","ファクタリング・資金調達のサポートサービス。","https://px.a8.net/svt/ejp?a8mat=KSUPPORT","2社間・3社間","3","15","300000","50000000","1","TRUE","即日入金可能、オンライン対応、個人事業主OK、全国対応、柔軟な審査","対応が迅速、審査が柔軟、全国対応","知名度がやや低い、手数料は個別査定","3.3","219","2018","建設業、運送業、製造業、IT・Web、サービス業"
"gmmi","喜望大地","ファクタリングサービス。中小企業の成長を支援。","https://px.a8.net/svt/ejp?a8mat=GMMI","2社間・3社間","3","15","300000","50000000","1","TRUE","即日入金可能、オンライン対応、個人事業主OK、全国対応、柔軟な審査","対応が迅速、審査が柔軟、全国対応","知名度がやや低い、手数料は個別査定","3.3","220","2018","建設業、運送業、製造業、IT・Web、サービス業"
"tomin-shinpan","トミンシンパン","東京・都民信販のファクタリングサービス。首都圏に強い。","https://px.a8.net/svt/ejp?a8mat=TOMINSHINPAN","2社間・3社間","3","15","300000","50000000","1","TRUE","東京拠点、首都圏に強い、即日入金、個人事業主OK、対面相談可","対応が迅速、審査が柔軟、全国対応","知名度がやや低い、手数料は個別査定","3.3","221","2000","建設業、運送業、製造業、IT・Web、サービス業"
"meisei-enterprise","明成エンタープライズ","ファクタリング・資金調達サービス。中小企業向け。","https://px.a8.net/svt/ejp?a8mat=MEISEIENTERPRISE","2社間・3社間","3","15","300000","50000000","1","TRUE","即日入金可能、オンライン対応、個人事業主OK、全国対応、柔軟な審査","対応が迅速、審査が柔軟、全国対応","知名度がやや低い、手数料は個別査定","3.3","222","2018","建設業、運送業、製造業、IT・Web、サービス業"
"i-service","iサービス","ファクタリングサービス。オンライン対応の資金調達。","https://px.a8.net/svt/ejp?a8mat=ISERVICE","2社間・3社間","3","15","300000","50000000","1","TRUE","オンライン対応、即日入金、個人事業主OK、全国対応、柔軟な審査","対応が迅速、審査が柔軟、全国対応","知名度がやや低い、手数料は個別査定","3.3","223","2018","建設業、運送業、製造業、IT・Web、サービス業"
"seino-financial","セイノーフィナンシャル","セイノーグループのファイナンスサービス。物流業界に強い。","https://px.a8.net/svt/ejp?a8mat=SEINOFINANCIAL","3社間","1","5","300000","50000000","3","TRUE","セイノーグループ、物流業界に強い、法人向け、大手運営、全国対応","対応が迅速、審査が柔軟、全国対応","知名度がやや低い、手数料は個別査定","3.5","224","2000","運送業、物流、製造業"
"sanctuary","サンクチュアリ","ファクタリングサービス。中小企業の資金繰り改善。","https://px.a8.net/svt/ejp?a8mat=SANCTUARY","2社間・3社間","3","15","300000","50000000","1","TRUE","即日入金可能、オンライン対応、個人事業主OK、全国対応、柔軟な審査","対応が迅速、審査が柔軟、全国対応","知名度がやや低い、手数料は個別査定","3.3","225","2018","建設業、運送業、製造業、IT・Web、サービス業"
"lagless","ラグレス","ファクタリングサービス。タイムラグのない資金調達を目指す。","https://px.a8.net/svt/ejp?a8mat=LAGLESS","2社間・3社間","3","15","300000","50000000","1","TRUE","即日入金、スピード重視、個人事業主OK、全国対応、オンライン対応","対応が迅速、審査が柔軟、全国対応","知名度がやや低い、手数料は個別査定","3.4","226","2018","建設業、運送業、製造業、IT・Web、サービス業"
"sinsia","シンシア","ファクタリング・資金調達サービス。真摯な対応。","https://px.a8.net/svt/ejp?a8mat=SINSIA","2社間・3社間","3","15","300000","50000000","1","TRUE","即日入金可能、オンライン対応、個人事業主OK、全国対応、柔軟な審査","対応が迅速、審査が柔軟、全国対応","知名度がやや低い、手数料は個別査定","3.3","227","2018","建設業、運送業、製造業、IT・Web、サービス業"
"s-radikal","S-radikal","ファクタリングサービス。中小企業向け資金調達。","https://px.a8.net/svt/ejp?a8mat=SRADIKAL","2社間・3社間","3","15","300000","50000000","1","TRUE","即日入金可能、オンライン対応、個人事業主OK、全国対応、柔軟な審査","対応が迅速、審査が柔軟、全国対応","知名度がやや低い、手数料は個別査定","3.3","228","2018","建設業、運送業、製造業、IT・Web、サービス業"
"fakutarikun","ふぁくたりくん","手軽にファクタリングが利用できるサービス。個人事業主OK。","https://px.a8.net/svt/ejp?a8mat=FAKUTARIKUN","2社間・3社間","3","18","300000","50000000","1","TRUE","手軽に利用、個人事業主OK、即日入金、全国対応、オンライン対応","対応が迅速、審査が柔軟、全国対応","知名度がやや低い、手数料は個別査定","3.4","229","2018","建設業、運送業、製造業、IT・Web、サービス業"
"sk-service","SKサービス","ファクタリング・資金調達サービス。中小企業向け。","https://px.a8.net/svt/ejp?a8mat=SKSERVICE","2社間・3社間","3","15","300000","50000000","1","TRUE","即日入金可能、オンライン対応、個人事業主OK、全国対応、柔軟な審査","対応が迅速、審査が柔軟、全国対応","知名度がやや低い、手数料は個別査定","3.3","230","2018","建設業、運送業、製造業、IT・Web、サービス業"
"zerofac","ZEROファク","手数料の低さが特長のファクタリングサービス。","https://px.a8.net/svt/ejp?a8mat=ZEROFAC","2社間・3社間","1","10","300000","50000000","1","TRUE","低手数料、即日入金、オンライン対応、個人事業主OK、全国対応","対応が迅速、審査が柔軟、全国対応","知名度がやや低い、手数料は個別査定","3.5","231","2018","建設業、運送業、製造業、IT・Web、サービス業"
"smfl","SMFL","三井住友ファイナンス＆リースのファクタリングサービス。","https://px.a8.net/svt/ejp?a8mat=SMFL","3社間","0.5","3","10000000","50000000","5","FALSE","三井住友グループ、大手金融機関、法人向け、大口対応、リース対応","対応が迅速、審査が柔軟、全国対応","知名度がやや低い、手数料は個別査定","3.7","232","1963","建設業、運送業、製造業、IT・Web、サービス業"
"luxel-partner","ラクセルパートナー","ファクタリングサービス。中小企業の資金繰りをサポート。","https://px.a8.net/svt/ejp?a8mat=LUXELPARTNER","2社間・3社間","3","15","300000","50000000","1","TRUE","即日入金可能、オンライン対応、個人事業主OK、全国対応、柔軟な審査","対応が迅速、審査が柔軟、全国対応","知名度がやや低い、手数料は個別査定","3.3","233","2018","建設業、運送業、製造業、IT・Web、サービス業"
"kosei","コーセイ","ファクタリング・資金調達サービス。","https://px.a8.net/svt/ejp?a8mat=KOSEI","2社間・3社間","3","15","300000","50000000","1","TRUE","即日入金可能、オンライン対応、個人事業主OK、全国対応、柔軟な審査","対応が迅速、審査が柔軟、全国対応","知名度がやや低い、手数料は個別査定","3.3","234","2018","建設業、運送業、製造業、IT・Web、サービス業"
"west-factoring","WEST","ファクタリングサービス。西日本を中心に対応。","https://px.a8.net/svt/ejp?a8mat=WESTFACTORING","2社間・3社間","3","15","300000","50000000","1","TRUE","西日本中心、即日入金、個人事業主OK、全国対応、対面相談可","対応が迅速、審査が柔軟、全国対応","知名度がやや低い、手数料は個別査定","3.3","235","2018","建設業、運送業、製造業、IT・Web、サービス業"
