"slug","name","description","affiliateUrl","factoringType","feeMin","feeMax","minAmount","maxAmount","speedDays","onlineComplete","features","pros","cons","overallRating","rankPosition","establishedYear","targetIndustries"
"top-management","トップ・マネジメント","累計取引件数5万件超の実績。最短即日入金、2社間・3社間両対応で幅広いニーズに応える。","https://px.a8.net/svt/ejp?a8mat=XXXXX38","2社間・3社間","1","15","300000","300000000","1","TRUE","累計5万件超の実績、最大3億円対応、即日入金、オンライン完結、ゼロファクタリングプラン","豊富な取引実績で安心、大口案件にも対応可能、手数料0%のプランもある","審査基準がやや厳しい場合も、大口以外は対応が遅くなる場合も","4.2","38","2009","建設業、運送業、製造業、医療・介護、人材派遣"
"witt","ウィット","小口専門のファクタリング会社。500万円以下の少額債権に特化し、電話1本で即日対応。","https://px.a8.net/svt/ejp?a8mat=XXXXX39","2社間","5","20","100000","5000000","1","TRUE","小口専門500万円以下、電話1本で対応、即日入金、来店不要、個人事業主OK","少額でも気軽に利用できる、電話1本で手続き開始、小回りの利く対応","500万円超の案件は対応不可、手数料がやや高め","3.6","39","2016","小売業、飲食業、サービス業、IT・Web、建設業"
"ennavi","えんナビ","24時間365日スタッフ対応。最短1日で資金化可能、少額から売掛債権の買取に対応。","https://px.a8.net/svt/ejp?a8mat=XXXXX40","2社間・3社間","5","20","300000","50000000","1","TRUE","24時間365日対応、最短1日入金、全国対応、オンライン完結、秘密厳守","24時間いつでも相談できる、全国どこからでも利用可能、秘密厳守で安心","手数料がやや高め、即日ではなく翌日になる場合も","3.7","40","2017","建設業、運送業、製造業、小売業、サービス業"
"jtc","JTC","入金前払いシステムを提供するファクタリング会社。売掛金を入金日より前に前払い。名古屋・大阪に拠点。","https://px.a8.net/svt/ejp?a8mat=XXXXX41","2社間・3社間","2","10","1000000","100000000","1","FALSE","入金前払いシステム、名古屋・大阪拠点、1億円まで対応、対面相談可能、経営コンサル対応","手数料が比較的低い、対面で丁寧に相談できる、大口案件にも対応","オンライン完結ではない、東京に拠点がない","4","41","2013","建設業、製造業、運送業、卸売業、医療・介護"
"shikin-pay","資金調達ペイ","オンライン完結型のファクタリングサービス。最短即日入金、必要書類が少なくスピーディーな手続き。","https://px.a8.net/svt/ejp?a8mat=XXXXX42","2社間","3","15","100000","50000000","1","TRUE","オンライン完結、最短即日入金、書類が少ない、全国対応、個人事業主OK","オンラインで手軽に利用可能、必要書類が少ない、即日入金に対応","対面相談ができない、知名度がまだ低い","3.7","42","2020","IT・Web、建設業、製造業、小売業"
"mizuho-factor","みずほファクター","みずほフィナンシャルグループの信頼性。大企業向けの3社間ファクタリングを中心に展開する老舗。","https://px.a8.net/svt/ejp?a8mat=XXXXX43","3社間","1","5","10000000","","7","FALSE","みずほグループ、大企業向け、3社間専門、低手数料、国際ファクタリング対応","メガバンクグループの圧倒的な信頼性、手数料が非常に低い、国際ファクタリングにも対応","中小企業・個人事業主は利用が難しい、入金まで時間がかかる","4.3","43","1977","製造業、卸売業、商社、大企業"
"mufg-factor","三菱UFJファクター","三菱UFJフィナンシャル・グループの大手ファクタリング会社。大企業・中堅企業向けの信頼性の高いサービス。","https://px.a8.net/svt/ejp?a8mat=XXXXX44","3社間","1","5","10000000","","7","FALSE","三菱UFJグループ、大企業向け、国際ファクタリング、一括ファクタリング、でんさい対応","日本最大級の金融グループの信頼性、手数料が非常に低い、多様なファクタリングサービス","中小企業・個人事業主には不向き、審査・入金に時間がかかる","4.3","44","1977","製造業、卸売業、商社、大企業"
"s-factoring","Sファクタリング","法人・個人事業主対応のファクタリングサービス。柔軟な審査で最短即日の資金調達が可能。","https://px.a8.net/svt/ejp?a8mat=XXXXX45","2社間","3","15","100000","30000000","1","TRUE","柔軟な審査、最短即日入金、オンライン完結、個人事業主OK、全国対応","審査が柔軟で通りやすい、オンラインで完結、即日入金に対応","知名度が低い、手数料の幅が広い","3.6","45","2020","IT・Web、建設業、小売業、サービス業"
"norikae-plus","のりかえPLUS","他社からの乗り換え専門ファクタリング。現在利用中の手数料より安くなることを保証するサービス。","https://px.a8.net/svt/ejp?a8mat=XXXXX46","2社間","1","10","300000","50000000","1","TRUE","乗り換え専門、手数料引き下げ保証、オンライン完結、即日入金、秘密厳守","他社より手数料が安くなることを保証、既にファクタリング利用中なら審査がスムーズ、即日入金対応","新規利用者は対象外、乗り換え元の情報提示が必要","3.9","46","2020","建設業、運送業、製造業、IT・Web、医療・介護"
"jps-factoring","JPS","法人向けファクタリングサービス。売掛金の買取を通じた中小企業の資金繰り支援を行う。","https://px.a8.net/svt/ejp?a8mat=XXXXX47","2社間・3社間","2","15","500000","50000000","2","FALSE","法人向け、2社間・3社間対応、全国対応、対面相談、経営相談対応","2社間・3社間の選択が可能、対面で丁寧なサポート、経営相談にも対応","オンライン完結に非対応、入金まで2日程度かかる","3.6","47","2016","建設業、製造業、運送業、卸売業"
"betrading","ビートレーディング","累計取引社数8.5万社超、累積買取額1,745億円の業界最大手。最短2時間で入金。","https://px.a8.net/svt/ejp?a8mat=BETRADING","2社間・3社間","2","12","10000","700000000","1","TRUE","最短2時間入金、累計8.5万社利用、注文書ファクタリング対応、オンライン完結、全国5拠点","業界最大手の安心感、最短2時間のスピード入金、2者間・3者間の両方に対応","大手のため審査がやや厳しい場合も、3社間は時間がかかる場合あり","4.6","48","2012","建設業、運送業、製造業、医療・介護、卸売業"
"ququmo","QuQuMo（ククモ）","オンライン完結で最速2時間入金。手数料1%～14.8%、個人事業主もOK。","https://px.a8.net/svt/ejp?a8mat=QUQUMO","2社間","1","14.8","10000","","1","TRUE","最速2時間入金、手数料1%〜、オンライン完結、個人事業主OK、金額上限なし","業界最安水準の手数料1%〜、最速2時間で資金化、必要書類が少ない","2者間のみ、電話サポートの時間が限られる","4.3","49","2017","IT・Web、建設業、製造業、小売業、サービス業"
"gmo-btob","GMO BtoB早払い","GMOペイメントゲートウェイ運営。注文書・請求書の両方を買取可能。","https://px.a8.net/svt/ejp?a8mat=GMOBTOB","2社間","1","12","1000000","1000000000","2","TRUE","東証プライム上場企業運営、注文書買取対応、手数料1%〜、オンライン完結、法人専用","上場企業の信頼性、注文書段階から買取可能、大口取引にも対応","法人のみ対応（個人事業主不可）、最短2営業日とやや遅め","4.2","50","1995","製造業、IT・Web、卸売業、建設業、運送業"
"ad-planning","アドプランニング","手数料2%～10%の業界最安水準。10万円からの少額買取にも対応。","https://px.a8.net/svt/ejp?a8mat=ADPLAN","2社間・3社間","2","10","100000","100000000","1","TRUE","手数料2%〜10%、少額10万円から対応、最短30分審査、審査通過率88%、資金繰りコンサル付き","業界最安水準の手数料、少額からも利用可能、コンサルティングサービス付き","知名度がやや低い、大口案件は別途相談","4","51","2018","IT・Web、建設業、小売業、飲食業、サービス業"
"chusho-support","日本中小企業金融サポート機構","一般社団法人運営の安心感。手数料1.5%～10%で非営利ならではの低コスト。","https://px.a8.net/svt/ejp?a8mat=CHUSHO","2社間・3社間","1.5","10","10000","","1","TRUE","一般社団法人運営、手数料1.5%〜、金額制限なし、オンライン完結、経営サポート付き","非営利法人で信頼性が高い、低手数料、経営改善のアドバイスも受けられる","知名度がやや低い、土日祝は対応不可","4.1","52","2017","建設業、運送業、製造業、医療・介護、小売業"
"zero-factoring","ファクタリングZERO","西日本エリアに強いファクタリング会社。手数料が安く地域密着型。","https://px.a8.net/svt/ejp?a8mat=ZEROFACT","2社間・3社間","1.5","10","300000","50000000","1","TRUE","西日本に強い、手数料1.5%〜、最短即日入金、対面相談可、個人事業主OK","西日本エリアに密着した対応、手数料が安い、対面でも相談可能","東日本では対面対応が難しい場合も、大口案件は別途相談","3.9","53","2018","建設業、運送業、製造業、小売業、飲食業"
"vistia","VISTIA（ヴィスティア）","東京秋葉原拠点のファクタリング会社。法人向け売掛金買取サービスを提供。","https://px.a8.net/svt/ejp?a8mat=VISTIA","2社間・3社間","3","15","100000","50000000","1","TRUE","即日入金対応、法人向け、柔軟な審査、全国対応、少額対応","柔軟な審査基準、即日入金可能、対面でも相談可","知名度がやや低い、手数料上限がやや高い","3.7","54","2019","建設業、運送業、IT・Web、製造業、サービス業"
"finto","Finto（フィント）","AI審査による最短翌日入金。手数料2%～9.5%。金額上限なし。","https://px.a8.net/svt/ejp?a8mat=FINTO","2社間","2","9.5","10000","","2","TRUE","AI審査、手数料2%〜9.5%、金額制限なし、オンライン完結、カード後払いも対応","AI審査で手続きが早い、手数料上限が低い、金額制限なし","最短翌日と即日ではない、知名度がやや低い","3.9","55","2020","IT・Web、小売業、サービス業、製造業、広告業"
"factoru","FACTOR⁺U（ファクトル）","日本中小企業金融サポート機構運営のAIファクタリング。手数料1.5%～、最短40分入金。","https://px.a8.net/svt/ejp?a8mat=FACTORU","2社間","1.5","10","10000","","1","TRUE","AI審査、最短40分入金、手数料1.5%〜、非営利法人運営、必要書類2点のみ","非営利法人の安心感、最短40分の超スピード、必要書類が少ない","知名度がまだ低い、2者間のみ","4","56","2017","建設業、運送業、製造業、IT・Web、医療・介護"
"sbi-factoring","SBI入金QUICK","SBIグループ運営のファクタリング。手数料0.5%～の業界最安水準。","https://px.a8.net/svt/ejp?a8mat=SBI","2社間","0.5","3.8","100000","","2","TRUE","手数料0.5%〜、SBIグループ運営、オンライン完結、法人向け、請求QUICKと連携","業界最安水準の手数料、SBIグループの安心感、請求書管理と一体化","法人限定、最短2営業日","4.1","57","2015","IT・Web、製造業、卸売業、サービス業、建設業"
"accretive","アクリーティブ","東証プライム上場・芙蓉リースグループ。医療・介護報酬ファクタリングに強い。","https://px.a8.net/svt/ejp?a8mat=ACCRET","3社間","0.25","5","1000000","","5","FALSE","東証プライム上場、医療・介護特化、年間取扱2000億円超、手数料月0.25%〜、全国47都道府県対応","上場企業の信頼性、医療・介護に強い、手数料が非常に安い","3社間のみ、入金まで日数がかかる","4","58","2000","医療・介護、調剤薬局、歯科、病院、介護施設"
"ja-mitsui-lease","JA三井リース","JA系×三井系の大手リース会社。売掛債権・手形債権の買取に対応。","https://px.a8.net/svt/ejp?a8mat=JAMITSUI","3社間","1","5","5000000","","5","FALSE","大手リース会社運営、売掛・手形両対応、農業分野にも強い、法人向け、全国対応","大手の安心感、農業・食品分野に強い、手形債権も対応","3社間のみ、個人事業主は不可、入金まで時間がかかる","3.8","59","2008","農業、食品、製造業、卸売業、運送業"
"mf-early-payment","マネーフォワード アーリーペイメント","マネーフォワードグループ運営。法人専門ファクタリングで即日入金可能。","https://px.a8.net/svt/ejp?a8mat=MFEP","2社間","1","10","500000","","1","TRUE","マネーフォワードグループ、法人専門、即日入金可能、債権譲渡登記不要、オンライン完結","上場グループの安心感、登記不要で取引先に知られない、即日入金","法人専門で個人事業主不可、比較的新しいサービス","4.2","60","2017","IT・Web、製造業、サービス業、卸売業、広告業"
"orix-factoring","オリックス","大手総合金融グループのファクタリング。安定した資金力と全国ネットワーク。","https://px.a8.net/svt/ejp?a8mat=ORIX","3社間","1","5","5000000","","5","FALSE","大手金融グループ、安定した資金力、全国対応、法人向け、大口取引対応","大手の信頼性、大口取引にも対応、全国ネットワーク","3社間のみ、個人事業主不可、審査に時間がかかる","3.8","61","1964","製造業、建設業、不動産業、卸売業、運送業"
"ntt-finance","NTTファイナンス","NTTグループのファクタリングサービス。安定基盤と低手数料が魅力。","https://px.a8.net/svt/ejp?a8mat=NTTF","3社間","0.5","3","5000000","","5","FALSE","NTTグループ運営、低手数料、法人向け、大口対応、全国対応","NTTグループの安心感、手数料が非常に安い、大口取引対応","3社間のみ、個人事業主不可、審査に時間がかかる","3.7","62","1985","IT・Web、通信、製造業、サービス業、建設業"
"soreiyu","ソレイユ","手数料1%～、最短30分で資金化。審査通過率90%の柔軟な対応。","https://px.a8.net/svt/ejp?a8mat=SOREIYU","2社間・3社間","1","15","100000","50000000","1","TRUE","最短30分審査、手数料1%〜、審査通過率90%、オンライン完結、個人事業主OK","審査が柔軟、手数料が安い、スピード対応","手数料上限がやや高い、知名度がやや低い","3.9","63","2018","建設業、運送業、IT・Web、小売業、飲食業"
"bestpay","ベストペイ（BESTPAY）","注文書ファクタリング専門。受注段階で資金化可能。手数料5%～。","https://px.a8.net/svt/ejp?a8mat=BESTPAY","2社間","5","20","1000000","300000000","2","TRUE","注文書ファクタリング専門、受注段階で資金化、手数料5%〜、最大3億円、オンライン完結","注文書段階で資金化可能、大口取引に対応、柔軟な審査","手数料が高め、最短翌営業日","3.8","64","2017","建設業、製造業、IT・Web、運送業、広告業"
"otti","OTTI（オッティ）","個人事業主から法人まで対応。最短即日入金、30万円から利用可能。","https://px.a8.net/svt/ejp?a8mat=OTTI","2社間・3社間","5","20","300000","50000000","1","TRUE","最短即日入金、30万円から対応、個人事業主OK、全国対応、オンライン対応","少額から利用可能、個人事業主も対応、即日入金可能","手数料上限が高め、手数料上限非公開","3.7","65","2017","建設業、運送業、IT・Web、小売業、飲食業"
"japanfactor","ジャパンファクター","福岡・東京2拠点。手数料5%～、診療報酬債権にも対応。","https://px.a8.net/svt/ejp?a8mat=JPFACTOR","2社間・3社間","5","20","100000","100000000","1","TRUE","福岡・東京2拠点、手数料5%〜、診療報酬対応、最短即日、個人事業主OK","九州エリアに強い、診療報酬債権にも対応、即日入金可能","手数料上限がやや高め、大手と比べて規模が小さい","3.8","66","2015","建設業、医療・介護、運送業、小売業、製造業"
"anchor-guardian","アンカーガーディアン","九州・西日本エリア特化。3社間3%～、2社間5%～の低手数料。","https://px.a8.net/svt/ejp?a8mat=ANCHOR","2社間・3社間","3","15","300000","50000000","1","TRUE","西日本特化、3社間3%〜、2社間5%〜、最短即日、対面相談可","西日本エリアに強い、手数料が安い、即日対応可能","西日本限定、東日本は対面対応不可","3.8","67","2016","建設業、運送業、製造業、小売業、飲食業"
"bion","バイオン","AI審査で最短60分。手数料一律10%の明朗会計。オンライン完結。","https://px.a8.net/svt/ejp?a8mat=BION","2社間","10","10","50000","","1","TRUE","AI審査、手数料一律10%、最短60分、5万円から対応、オンライン完結","手数料が明確で分かりやすい、少額から利用可能、AI審査で早い","手数料が一律10%で割高な場合も、2者間のみ","3.7","68","2020","IT・Web、小売業、サービス業、建設業、飲食業"
"fukuoka-factoring","ファクタリング福岡","創業20年の九州エリア特化ファクタリング。最短3時間で資金化。","https://px.a8.net/svt/ejp?a8mat=FUKUOKA","2社間・3社間","2","15","300000","50000000","1","TRUE","創業20年の実績、九州特化、最短3時間、個人事業主OK、全国対応","九州の事業者に特化、長年の実績、スピード対応","九州以外は対面不可、手数料上限がやや高い","3.7","69","2004","建設業、運送業、製造業、飲食業、小売業"
"factoring-japan","ファクタリングジャパン","2社間・3社間対応。50万円～最大3億円まで。最短即日入金。","https://px.a8.net/svt/ejp?a8mat=FCTJP","2社間・3社間","3","15","500000","300000000","1","TRUE","最大3億円対応、即日入金可能、2社間・3社間対応、全国対応、電子契約対応","大口取引にも対応、即日入金可能、柔軟な対応","知名度が低め、手数料は要相談","3.6","70","2018","建設業、製造業、IT・Web、運送業、卸売業"
"tokyo-spc","東京SPCマネジメント","流動化・証券化の専門会社。診療・介護報酬ファクタリングにも対応。","https://px.a8.net/svt/ejp?a8mat=TSPC","2社間・3社間","3","15","1000000","","3","FALSE","証券化の専門家、診療報酬対応、介護報酬対応、自社出資100%、法人向け","証券化のプロ、医療・介護にも対応、自社資金で安定","手数料非公開、個人事業主不可","3.6","71","1999","医療・介護、製造業、建設業、卸売業、不動産業"
"shikin-quick","資金調達QUICK","手数料1%～。最短10分入金、累計申込10万件超のオンラインファクタリング。","https://px.a8.net/svt/ejp?a8mat=SQUICK","2社間","1","15","10000","","1","TRUE","最短10分入金、手数料1%〜、累計10万件超、オンライン完結、個人事業主OK","最短10分のスピード、手数料が安い、実績豊富","2者間のみ、手数料上限が高い場合も","4","72","2020","IT・Web、建設業、小売業、サービス業、飲食業"
"invoice-pay","インボイスPay","スマートヘッジ運営。手数料2.5%～、最短即日入金。累計100億円超の買取実績。","https://px.a8.net/svt/ejp?a8mat=INVPAY","2社間","2.5","15","100000","","1","TRUE","最短即日入金、手数料2.5%〜、累計100億円超、債権譲渡登記不要、オンライン完結","手数料が安い、債権譲渡登記不要、スピーディ","比較的新しい会社、知名度が低め","3.9","73","2019","IT・Web、建設業、サービス業、小売業、製造業"
"jfs","ジャパン・ファイナンシャル・ソリューションズ","法人向けファクタリング。柔軟な審査と丁寧な対応が特長。","https://px.a8.net/svt/ejp?a8mat=JFS","2社間・3社間","3","15","300000","100000000","1","TRUE","柔軟な審査、即日入金可能、全国対応、法人向け、丁寧なサポート","審査が柔軟、対応が丁寧、即日入金可能","知名度が低め、手数料は個別査定","3.6","74","2018","建設業、運送業、製造業、IT・Web、サービス業"
"showa-lease","昭和リース","SBIグループの大手リース会社。売掛債権ファクタリングを提供。","https://px.a8.net/svt/ejp?a8mat=SHOWA","3社間","1","5","5000000","","5","FALSE","SBIグループ、大手リース会社、法人向け、大口対応、全国対応","大手の安心感、手数料が安い","3社間のみ、個人事業主不可、入金まで時間がかかる","3.6","75","1969","製造業、建設業、不動産業、卸売業、運送業"
"hamagin-finance","浜銀ファイナンス","横浜銀行グループのファクタリング。地域密着で神奈川・東京エリアに強い。","https://px.a8.net/svt/ejp?a8mat=HAMAGIN","3社間","1","5","5000000","","5","FALSE","横浜銀行グループ、地域密着、法人向け、神奈川・東京に強い、安定した資金力","銀行グループの安心感、地域企業に強い","3社間のみ、エリアが限定的、個人事業主不可","3.5","76","1979","製造業、建設業、卸売業、小売業、サービス業"
"rico-lease","リコーリース","リコーグループのリース・ファクタリングサービス。安定基盤の大手。","https://px.a8.net/svt/ejp?a8mat=RICOL","3社間","1","5","5000000","","5","FALSE","リコーグループ、東証プライム上場、法人向け、大口対応、全国対応","上場企業グループ、安定した資金力","3社間のみ、個人事業主不可","3.5","77","1976","製造業、IT・Web、サービス業、建設業、卸売業"
"paypal-biz-loan","PayPay銀行ビジネスローン","PayPay銀行が提供するビジネスローン。ファクタリングではなく融資型の資金調達。","https://px.a8.net/svt/ejp?a8mat=PAYPALBIZLOAN","2社間","1.8","13.8","300000","50000000","3","TRUE","PayPay銀行運営、最短翌営業日融資、来店不要、法人・個人事業主OK、ビジネスローン","対応が迅速、審査が柔軟、全国対応","知名度がやや低い、手数料は個別査定","3.6","78","2000","建設業、運送業、製造業、IT・Web、サービス業"
"nx-capital","NXキャピタル","日本通運グループのファイナンスサービス。物流業界に強い。","https://px.a8.net/svt/ejp?a8mat=NXCAPITAL","3社間","1","5","5000000","50000000","5","FALSE","日本通運グループ、物流業界特化、法人向け、大口対応、全国対応","対応が迅速、審査が柔軟、全国対応","知名度がやや低い、手数料は個別査定","3.5","79","2000","建設業、運送業、製造業、IT・Web、サービス業"
"kensetsu-keiei","建設経営サービス","建設業界特化のファクタリング。建設会社の資金繰りをサポート。","https://px.a8.net/svt/ejp?a8mat=KENSETSUKEIEI","2社間・3社間","3","15","300000","50000000","1","TRUE","建設業特化、即日入金可能、全国対応、個人事業主OK、建設業界に詳しい","対応が迅速、審査が柔軟、全国対応","知名度がやや低い、手数料は個別査定","3.5","80","2015","建設業"
"biz-partner","BIZパートナー","中小企業向けファクタリング。柔軟な審査で即日対応。","https://px.a8.net/svt/ejp?a8mat=BIZPARTNER","2社間・3社間","3","15","300000","50000000","1","TRUE","即日入金可能、オンライン対応、個人事業主OK、全国対応、柔軟な審査","対応が迅速、審査が柔軟、全国対応","知名度がやや低い、手数料は個別査定","3.4","81","2018","建設業、運送業、製造業、IT・Web、サービス業"
"j-cloud","ジェイクラウド","クラウド型ファクタリングサービス。オンライン完結で手軽。","https://px.a8.net/svt/ejp?a8mat=JCLOUD","2社間・3社間","2","12","300000","50000000","1","TRUE","オンライン完結、クラウド型、即日入金、個人事業主OK、少額対応","対応が迅速、審査が柔軟、全国対応","知名度がやや低い、手数料は個別査定","3.5","82","2018","建設業、運送業、製造業、IT・Web、サービス業"
