"slug","name","description","affiliateUrl","factoringType","feeMin","feeMax","minAmount","maxAmount","speedDays","onlineComplete","features","pros","cons","overallRating","rankPosition","establishedYear","targetIndustries"
"best-factor","ベストファクター","業界最安水準の手数料と即日入金が魅力のファクタリング会社。オンライン完結で全国対応、幅広い業種に対応しています。","https://px.a8.net/svt/ejp?a8mat=XXXXX1","2社間・3社間","2","20","300000","100000000","1","TRUE","即日入金可能、オンライン完結、審査通過率93%、個人事業主OK、全国対応","業界最安水準の手数料、最短即日で資金調達可能、オンラインで手続き完結","3社間ファクタリングは時間がかかる場合あり、初回は審査に時間がかかることも","4.5","1","2017","建設業、運送業、製造業、IT・Web、医療・介護"
"olta","OLTA（オルタ）","クラウドファクタリングのパイオニア。AIを活用した審査で最短即日、完全オンラインで手続きが完了します。","https://px.a8.net/svt/ejp?a8mat=XXXXX2","2社間","2","9","","","1","TRUE","AI審査、完全オンライン、請求書のアップロードだけ、手数料上限9%、金額制限なし","手数料が業界最安（2〜9%）、面談不要で完全オンライン、AI審査で最短即日入金","2社間ファクタリングのみ、対面での相談ができない","4.7","2","2017","IT・Web、広告・メディア、人材派遣、製造業"
"pay-today","PayToday（ペイトゥデイ）","AI審査で最短30分入金。手数料1%〜と業界最安水準を実現するオンラインファクタリングサービス。","https://px.a8.net/svt/ejp?a8mat=XXXXX3","2社間","1","9.5","","","1","TRUE","最短30分入金、手数料1%〜、AI審査、完全オンライン、少額OK","手数料が1%〜と非常に安い、最短30分での入金実績、少額から利用可能","新しいサービスで実績が少ない、電話サポートが限定的","4.3","3","2021","IT・Web、小売業、飲食業、広告・メディア"
"quartett","QuQuMo（ククモ）","最短2時間で入金可能なスピード特化型ファクタリング。手続きもシンプルでオンライン完結。","https://px.a8.net/svt/ejp?a8mat=XXXXX4","2社間","1","14.8","","","1","TRUE","最短2時間入金、オンライン完結、必要書類が少ない、個人事業主OK、法人専用プランあり","入金スピードが非常に速い、必要書類が少なく手軽、手数料が比較的安い","手数料の上限がやや高め、3社間ファクタリングに非対応","4.1","4","2020","建設業、運送業、製造業、小売業"
"no1","No.1ファクタリング","建設業界に強いファクタリング会社。対面相談も可能で、手厚いサポートが魅力。全国出張対応。","https://px.a8.net/svt/ejp?a8mat=XXXXX5","2社間・3社間","1","15","500000","50000000","1","FALSE","建設業特化、対面相談可能、全国出張対応、3社間対応、診療報酬対応","建設業の実績が豊富、対面で丁寧に相談できる、3社間ファクタリングにも対応","オンライン完結ではない、手数料の幅が広い","4","5","2016","建設業、運送業、医療・介護、製造業"
"accel-factor","アクセルファクター","業界トップクラスのスピード対応が強み。最短2時間での入金実績があり、急ぎの資金調達に最適なファクタリング会社です。少額から利用可能で、中小企業・個人事業主に幅広く対応。","https://px.a8.net/svt/ejp?a8mat=XXXXX6","2社間・3社間","2","20","300000","100000000","1","TRUE","最短2時間入金、審査通過率93%以上、少額30万円から対応、オンライン完結、全国対応","業界最速クラスの入金スピード、少額債権でも柔軟に対応、審査通過率が非常に高い","手数料が他社よりやや高めになる場合がある、電話対応が混み合うことがある","4.3","6","2018","建設業、運送業、製造業、小売業、サービス業"
"msfj","MSFJ","業界最安水準の手数料1%〜が最大の魅力。コスト重視の企業に選ばれているファクタリング会社で、手数料の透明性にも定評があります。","https://px.a8.net/svt/ejp?a8mat=XXXXX7","2社間・3社間","1","10","100000","50000000","2","TRUE","手数料1%〜、手数料の明確提示、リピート割引あり、オンライン完結、秘密厳守","業界最安水準の手数料体系、手数料が事前に明確に提示される、リピート利用で手数料がさらに優遇","入金まで最短2日かかる、高額案件の対応上限がやや低め","4.2","7","2017","IT・Web、広告業、コンサルティング、製造業、卸売業"
"trusfort","トラストフォート","個人事業主・フリーランスに特化したファクタリングサービス。少額債権にも柔軟に対応し、初めての方でも安心して利用できるサポート体制が充実しています。","https://px.a8.net/svt/ejp?a8mat=XXXXX8","2社間","3","18","100000","30000000","1","TRUE","個人事業主特化、10万円から利用可能、初回サポート充実、オンライン完結、必要書類が少ない","個人事業主でも利用しやすい審査基準、少額10万円から対応可能、初めてでも安心の丁寧なサポート","法人向けの大口案件には不向き、3社間ファクタリングに非対応","4","8","2019","フリーランス、個人事業主、クリエイター、士業、飲食業"
"mentor-capital","メンターキャピタル","最大1億円までの大口ファクタリングに対応。中堅〜大企業の大型債権の買取に強みを持ち、経験豊富な専任担当者がサポートします。","https://px.a8.net/svt/ejp?a8mat=XXXXX9","2社間・3社間","2","15","1000000","100000000","2","FALSE","最大1億円対応、専任担当者制、大口案件に強い、3社間で手数料優遇、法人向けサービス充実","大口債権にも柔軟に対応可能、専任担当者による手厚いサポート、3社間利用で手数料を抑えられる","少額案件には対応していない、オンライン完結には非対応で面談が必要","4.1","9","2016","建設業、製造業、卸売業、不動産業、人材派遣業"
"japan-maison","日本中小企業金融サポート機構","一般社団法人が運営する非営利型のファクタリングサービス。営利目的ではないため手数料が低く抑えられ、中小企業の資金繰り改善を本格的に支援しています。","https://px.a8.net/svt/ejp?a8mat=XXXXX10","2社間・3社間","1.5","10","500000","300000000","3","TRUE","一般社団法人運営、非営利で手数料が低い、経営相談も対応、全国対応、資金繰りコンサル付き","非営利団体のため手数料が低い、資金調達だけでなく経営相談もできる、社団法人の信頼性・安心感","入金まで最短3日と時間がかかる、急ぎの資金調達には不向き","4.4","10","2017","建設業、製造業、運送業、医療・介護、小売業"
"freenance","フリーナンス","GMOグループが運営するフリーランス向け総合サービス。ファクタリング機能「即日払い」に加え、損害賠償保険やバーチャルオフィスなど、フリーランスの働き方を総合的にサポートします。","https://px.a8.net/svt/ejp?a8mat=XXXXX11","2社間","3","10","10000","10000000","1","TRUE","GMOグループ運営、即日払い対応、損害賠償保険付帯、1万円から利用可能、アプリで簡単操作","大手GMOグループの安心感、1万円の少額から利用できる、保険やバーチャルオフィスなど付帯サービスが豊富","法人向けの大口案件には不向き、フリーランス以外は利用しにくい","4.3","11","2018","フリーランス、クリエイター、エンジニア、ライター、デザイナー"
"labol","ラボル","IT・クリエイター業界に特化したファクタリングサービス。業界の商習慣を理解した審査体制で、Web制作やシステム開発など長期プロジェクトの売掛金にも柔軟に対応します。","https://px.a8.net/svt/ejp?a8mat=XXXXX12","2社間","3","10","10000","10000000","1","TRUE","IT・クリエイター特化、最短60分入金、1万円から利用OK、24時間申込可能、オンライン完結","IT業界の商習慣を理解した審査、最短60分のスピード入金、少額1万円から気軽に利用可能","IT・クリエイター以外の業種は審査が厳しい場合あり、上限金額がやや低め","3.9","12","2021","IT・Web、システム開発、デザイン、映像制作、ゲーム開発"
"bitresy","ビートレーディング","累計取引実績5万件以上を誇る業界の老舗ファクタリング会社。豊富な実績とノウハウで、幅広い業種・規模の企業に対応。安定したサービス品質が信頼されています。","https://px.a8.net/svt/ejp?a8mat=XXXXX13","2社間・3社間","2","12","500000","300000000","2","TRUE","累計取引5万件超、最大3億円対応、全国5拠点、オンライン完結、専任担当者制","業界トップクラスの取引実績で安心、少額から大口まで幅広く対応、全国に拠点があり対面相談も可能","即日入金は条件による、手数料は案件ごとに変動が大きい","4.6","13","2012","建設業、運送業、製造業、医療・介護、人材派遣業"
"anew","anew","OLTAと新生銀行（SBI新生銀行）の共同出資で設立されたファクタリング会社。フィンテック企業と銀行の強みを融合し、低手数料かつ信頼性の高いサービスを提供しています。","https://px.a8.net/svt/ejp?a8mat=XXXXX14","2社間","2","9","500000","50000000","2","TRUE","OLTA×新生銀行共同出資、AI審査で低手数料、銀行グループの信頼性、オンライン完結、秘密厳守","銀行系の信頼性と透明性、AI審査により手数料が低く抑えられる、オンラインで手続きが完結","審査がやや厳格で通過しない場合もある、即日入金は原則非対応","4.2","14","2020","IT・Web、製造業、卸売業、サービス業、広告業"
"next-one","ネクストワン","建設業・医療業界に特化したファクタリング会社。業界特有の支払いサイトの長さや売掛金の特性を熟知しており、専門性の高い審査と柔軟な対応が強みです。","https://px.a8.net/svt/ejp?a8mat=XXXXX15","2社間・3社間","1.5","15","300000","50000000","1","FALSE","建設・医療業界特化、診療報酬ファクタリング対応、業界専門スタッフ在籍、即日入金可能、出張対応あり","建設・医療業界への深い理解と柔軟な審査、診療報酬債権にも対応、出張面談で地方企業にも対応","対応業界以外の審査はやや時間がかかる、オンライン完結に対応していない","3.8","15","2019","建設業、医療・介護、調剤薬局、歯科、土木業"
"ace-trust","エーストラスト","独自の柔軟な審査基準で高い契約率を誇るファクタリング会社。最短2時間で送金完了、最大5,000万円まで対応。","https://px.a8.net/svt/ejp?a8mat=XXXXX16","2社間","1","15","300000","50000000","1","TRUE","最短2時間送金、柔軟な審査基準、オンライン完結、全国対応、個人事業主OK","審査が柔軟で通りやすい、入金スピードが速い、対面・オンラインどちらも対応","知名度がやや低い、手数料の幅が広い","4","16","2018","建設業、運送業、製造業、IT・Web、サービス業"
"kaisoku","買速（KAISOKU）","最短30分で入金可能な超スピード対応ファクタリング。審査通過率92%、10万円の少額から対応。","https://px.a8.net/svt/ejp?a8mat=XXXXX17","2社間","2","10","100000","","1","TRUE","最短30分入金、審査通過率92%、10万円から対応、Zoom契約対応、CloudSign電子契約","業界最速クラスの入金スピード、少額10万円から利用可能、赤字決算・税金滞納でも利用可","2社間ファクタリングのみ、対面での相談ができない","4.2","17","2020","建設業、運送業、製造業、小売業、飲食業"
"factoring-zero","ファクタリングZERO","福岡発、西日本を中心に展開するファクタリング会社。審査通過率96%、20万円〜5,000万円まで対応。","https://px.a8.net/svt/ejp?a8mat=XXXXX18","2社間・3社間","3","18","200000","50000000","1","TRUE","審査通過率96%、西日本に強い、診療・介護報酬対応、オンライン完結、2011年設立の実績","審査通過率が非常に高い、診療・介護報酬にも対応、西日本エリアに強い","東日本では対面対応が難しい場合あり、手数料の上限がやや高め","3.9","18","2011","建設業、医療・介護、運送業、製造業、小売業"
"factorplan","ファクタープラン","「会わずに、迷わず、すぐ進む」がコンセプト。最短4時間で資金化、調達成功率95.2%。","https://px.a8.net/svt/ejp?a8mat=XXXXX19","2社間","3","18","100000","50000000","1","TRUE","最短4時間で資金化、調達成功率95.2%、スマホで完結、全国対応、リピート率92.7%","スマホだけで申込から契約まで完結、調達成功率が非常に高い、チャットで進捗確認可能","2社間ファクタリングのみ、手数料がやや高めの場合がある","3.8","19","2019","建設業、IT・Web、広告・メディア、運送業、製造業"
"ag-business","AGビジネスサポート","アイフルグループ運営の信頼性抜群のファクタリング。契約実績15万件以上、請求書1枚から申込可能。","https://px.a8.net/svt/ejp?a8mat=XXXXX20","2社間・3社間","2","12","","","1","TRUE","アイフルグループ、契約実績15万件超、請求書1枚からOK、5秒診断あり、赤字決算でも対応","大手アイフルグループの安心感、請求書1枚から気軽に利用可能、赤字決算・債務超過でも対応","大手のため審査がやや厳格な場合も、手数料は案件による","4.4","20","2001","建設業、製造業、運送業、小売業、サービス業"
"onebank","ワンバンク請求書買取","個人事業主・フリーランス専門の請求書買取サービス。最短60分で即日現金化、決算書不要。","https://px.a8.net/svt/ejp?a8mat=XXXXX21","2社間","6","15","10000","10000000","1","TRUE","最短60分入金、決算書不要、面談不要、50業種以上対応、オンライン完結","決算書が不要で手軽、フリーランスに特化したサービス、最短60分のスピード入金","法人向けの大口案件には不向き、手数料の下限がやや高め","3.8","21","2023","IT・Web、広告・メディア、デザイン、映像制作、飲食業"
"factoring-try","ファクタリングのTRY","ノンリコース契約で売掛先倒産リスクなし。10万円〜5,000万円以上、24時間365日電話受付。","https://px.a8.net/svt/ejp?a8mat=XXXXX22","2社間","3","20","100000","50000000","1","TRUE","ノンリコース契約、24時間電話受付、税金滞納中でもOK、LINE申込対応、乗り換え手数料優遇","24時間365日電話対応で安心、税金滞納中でも契約可能、乗り換え時に手数料優遇あり","手数料の上限がやや高い、オンライン審査の精度は他社に劣る場合も","3.7","22","2018","建設業、運送業、製造業、小売業、サービス業"
"paytner","ペイトナー","最短10分で請求書を現金化。手数料一律10%で明瞭、1万円の少額から利用可能なフリーランス向けサービス。","https://px.a8.net/svt/ejp?a8mat=XXXXX23","2社間","10","10","10000","1000000","1","TRUE","最短10分入金、手数料一律10%、1万円から利用OK、書類3点のみ、アプリ対応","最短10分の超高速入金、手数料が一律で分かりやすい、必要書類が非常に少ない","手数料10%固定で割高な場合も、買取上限が100万円と低い","4.1","23","2019","IT・Web、デザイン、広告・メディア、飲食業"
"nishi-nihon-factor","西日本ファクター","中国・九州エリア密着型のファクタリング会社。最短即日で1,000万円まで買取可能。地域企業に強い。","https://px.a8.net/svt/ejp?a8mat=XXXXX24","2社間・3社間","2","15","300000","30000000","1","FALSE","中国・九州エリア特化、最短即日入金、対面相談可能、地域密着サポート、経営相談対応","西日本エリアに密着した対応、対面での丁寧な相談が可能、地域企業の事情に精通","東日本では利用しにくい、オンライン完結に非対応","3.9","24","2017","建設業、運送業、製造業、医療・介護、小売業"
"sokumu","SoKuMo（ソクモ）","即日お見積りのオンラインファクタリング。手数料1%〜、最短即日で入金。シンプルな手続きが特徴。","https://px.a8.net/svt/ejp?a8mat=XXXXX25","2社間","1","15","100000","","1","TRUE","手数料1%〜、即日見積もり、オンライン完結、シンプル手続き、全国対応","手数料が1%〜と低い、即日で見積もりが出る、オンラインで手軽に利用可能","知名度がまだ低い、実績が少なめ","3.8","25","2021","IT・Web、建設業、製造業、小売業"
"act-will","アクト・ウィル","最高1億円までの大口ファクタリングに対応。審査通過率90%以上、最短即日で入金可能。","https://px.a8.net/svt/ejp?a8mat=XXXXX26","2社間・3社間","3","20","300000","100000000","1","FALSE","最高1億円対応、審査通過率90%以上、即日入金可能、大口案件に強い、全国出張対応","大口の資金調達に対応、審査通過率が高い、全国出張対応で地方でも安心","オンライン完結に非対応、少額案件には不向き","3.9","26","2017","建設業、運送業、製造業、不動産業、卸売業"
"japan-management","ジャパンマネジメント","東京・福岡の2拠点で全国対応。2社間・3社間両対応、24時間相談受付で最短即日審査完了。","https://px.a8.net/svt/ejp?a8mat=XXXXX27","2社間・3社間","3","20","500000","50000000","1","FALSE","東京・福岡2拠点、24時間相談対応、全国出張可能、3社間で手数料優遇、即日審査完了","24時間いつでも相談できる、2拠点で広いエリアをカバー、対面での丁寧なサポート","オンライン完結ではない、手数料の上限がやや高め","3.8","27","2016","建設業、運送業、製造業、医療・介護、飲食業"
"pmg","PMG","ピーエムジー株式会社が運営。月間取扱件数500件以上、新規契約率98%の業界トップクラスの実績。","https://px.a8.net/svt/ejp?a8mat=XXXXX28","2社間・3社間","2","15","500000","200000000","1","TRUE","月間500件以上の取扱、新規契約率98%、最大2億円対応、オンライン完結、全国対応","圧倒的な取扱実績で安心、大口案件にも対応可能、新規契約率が非常に高い","少額案件は優先度が下がる場合あり、手数料は案件による","4.1","28","2015","建設業、運送業、製造業、医療・介護、人材派遣"
"sankyo-service","三共サービス","創業20年以上の老舗ファクタリング会社。元金融マンによる丁寧な対応と業界最安水準の手数料が魅力。","https://px.a8.net/svt/ejp?a8mat=XXXXX29","2社間・3社間","1.5","10","500000","100000000","2","FALSE","創業20年以上、元金融マン対応、手数料が業界最安水準、最大1億円対応、法人専門","長年の実績と信頼性、手数料が低い、金融のプロによる丁寧なサポート","個人事業主は利用不可、入金まで2日程度かかる","4","29","2001","建設業、製造業、運送業、卸売業、人材派遣"
"trust-gateway","トラストゲートウェイ","福岡拠点のファクタリング会社。審査通過率95%以上、クラウド契約で来店不要。医療系にも対応。","https://px.a8.net/svt/ejp?a8mat=XXXXX30","2社間・3社間","3","18","100000","30000000","1","TRUE","審査通過率95%以上、クラウド契約対応、医療系対応、福岡拠点、全国対応","審査通過率が非常に高い、クラウド契約で来店不要、医療系の売掛金にも対応","福岡以外の対面は難しい、手数料の上限がやや高め","3.8","30","2018","医療・介護、建設業、運送業、製造業、サービス業"
"kyoei-support","共栄サポート","中小企業向けファクタリングを提供。柔軟な審査と丁寧なサポートで初めての方にも安心。","https://px.a8.net/svt/ejp?a8mat=XXXXX31","2社間","3","15","300000","30000000","1","TRUE","中小企業向け、柔軟な審査、丁寧なサポート、オンライン完結、全国対応","審査が柔軟で通りやすい、初めてでも丁寧にサポート、中小企業のニーズに合ったサービス","大口案件には不向き、知名度がまだ低い","3.7","31","2019","小売業、飲食業、サービス業、IT・Web"
"kensetsukun","けんせつくん","建設業界専門のファクタリングサービス。最短2時間で売掛金を現金化、スマホひとつで申込から契約まで完結。","https://px.a8.net/svt/ejp?a8mat=XXXXX32","2社間","5","20","100000","50000000","1","TRUE","建設業界専門、最短2時間入金、スマホで完結、来店不要、個人事業主OK","建設業界に特化した審査ノウハウ、スマホだけで手続き完結、即日入金に対応","建設業以外は利用できない、手数料がやや高め","3.9","32","2018","建設業、土木業"
"jigyou-agent","事業資金エージェント","最短2時間で資金化可能なファクタリング会社。500万円以下は来店不要、1.5%〜の低手数料。","https://px.a8.net/svt/ejp?a8mat=XXXXX33","2社間・3社間","1.5","15","100000","200000000","1","TRUE","最短2時間入金、500万円以下は来店不要、最大2億円対応、1.5%〜低手数料、リピート率90%以上","手数料1.5%〜と低い、最大2億円の大口にも対応、500万円以下はオンライン完結","500万円超は面談が必要、手数料の幅が広い","4","33","2014","建設業、運送業、製造業、IT・Web、医療・介護"
"quick-management","クイックマネジメント","最短30分のスピード入金。オンライン完結で全国対応、AIを活用した審査で手続きがスムーズ。","https://px.a8.net/svt/ejp?a8mat=XXXXX34","2社間","1","15","","","1","TRUE","最短30分入金、AI審査、オンライン完結、金額制限なし、全国対応","最短30分のスピード入金、AI審査でスムーズ、金額制限がない","2社間ファクタリングのみ、新しい会社で実績が少なめ","3.9","34","2021","IT・Web、建設業、運送業、広告・メディア"
"trapay","トラペイ","オンライン完結型ファクタリング。手数料は業界最安水準、必要書類も少なく初めてでも簡単に利用可能。","https://px.a8.net/svt/ejp?a8mat=XXXXX35","2社間","2","12","100000","50000000","1","TRUE","オンライン完結、業界最安水準の手数料、必要書類が少ない、全国対応、法人・個人対応","手数料が低く抑えられる、オンラインで全て完結、書類が少なく手軽","対面での相談ができない、知名度がまだ低い","3.8","35","2022","IT・Web、製造業、小売業、サービス業"
"minnano-factoring","みんなのファクタリング","個人事業主・フリーランス向けのオンラインファクタリング。手続きが簡単で少額から利用可能。","https://px.a8.net/svt/ejp?a8mat=XXXXX36","2社間","5","15","10000","5000000","1","TRUE","個人事業主向け、少額対応、オンライン完結、簡単手続き、即日入金","1万円から少額利用可能、手続きが非常にシンプル、即日で入金される","買取上限が500万円と低い、法人の大口案件には不向き","3.7","36","2021","IT・Web、デザイン、広告・メディア、飲食業"
"urikakedo","うりかけ堂","低手数料とスピーディーな入金が特徴。最短2時間で資金化、全国対応のオンラインファクタリング。","https://px.a8.net/svt/ejp?a8mat=XXXXX37","2社間・3社間","2","12","300000","50000000","1","TRUE","最短2時間入金、低手数料、全国対応、3社間対応、個人事業主OK","手数料が低く抑えられる、入金スピードが速い、3社間でさらに手数料を抑えられる","知名度がまだ低い、大口案件の対応は要相談","3.8","37","2019","建設業、運送業、製造業、小売業、サービス業"
