"slug","name","description","affiliateUrl","factoringType","feeMin","feeMax","minAmount","maxAmount","speedDays","onlineComplete","features","pros","cons","overallRating","rankPosition","establishedYear","targetIndustries"
"zaizen-group","財全グループ","札幌拠点のファクタリング会社。北海道・東北に強い。","https://px.a8.net/svt/ejp?a8mat=ZAIZENGROUP","2社間・3社間","3","15","300000","50000000","1","TRUE","北海道に強い、即日入金、個人事業主OK、全国対応、対面相談可","対応が迅速、審査が柔軟、全国対応","知名度がやや低い、手数料は個別査定","3.5","83","2010","建設業、運送業、製造業、農業、飲食業"
"business-assist","ビジネスアシスト","中小企業の資金調達を総合サポート。ファクタリング・融資に対応。","https://px.a8.net/svt/ejp?a8mat=BUSINESSASSIST","2社間・3社間","3","15","300000","50000000","1","TRUE","即日入金可能、オンライン対応、個人事業主OK、全国対応、柔軟な審査","対応が迅速、審査が柔軟、全国対応","知名度がやや低い、手数料は個別査定","3.4","84","2018","建設業、運送業、製造業、IT・Web、サービス業"
"suga-finance","すがファイナンス","個人事業主から法人まで幅広く対応するファクタリング会社。","https://px.a8.net/svt/ejp?a8mat=SUGAFINANCE","2社間・3社間","3","18","300000","50000000","1","TRUE","即日入金可能、オンライン対応、個人事業主OK、全国対応、柔軟な審査","対応が迅速、審査が柔軟、全国対応","知名度がやや低い、手数料は個別査定","3.4","85","2018","建設業、運送業、製造業、IT・Web、サービス業"
"atest-capital","エーテスキャピタル","中小企業向けファクタリングサービス。柔軟な審査が特長。","https://px.a8.net/svt/ejp?a8mat=ATESTCAPITAL","2社間・3社間","3","15","300000","50000000","1","TRUE","即日入金可能、オンライン対応、個人事業主OK、全国対応、柔軟な審査","対応が迅速、審査が柔軟、全国対応","知名度がやや低い、手数料は個別査定","3.4","86","2018","建設業、運送業、製造業、IT・Web、サービス業"
"linx-japan","Linx Japan","法人向けファクタリング。スピーディな対応と柔軟な審査。","https://px.a8.net/svt/ejp?a8mat=LINXJAPAN","2社間・3社間","2","15","300000","50000000","1","TRUE","即日入金可能、オンライン対応、個人事業主OK、全国対応、柔軟な審査","対応が迅速、審査が柔軟、全国対応","知名度がやや低い、手数料は個別査定","3.5","87","2018","建設業、運送業、製造業、IT・Web、サービス業"
"t-and-s","ティー・アンド・エス","ファクタリング・事業資金の調達をサポート。全国対応。","https://px.a8.net/svt/ejp?a8mat=TANDS","2社間・3社間","3","15","300000","50000000","1","TRUE","即日入金可能、オンライン対応、個人事業主OK、全国対応、柔軟な審査","対応が迅速、審査が柔軟、全国対応","知名度がやや低い、手数料は個別査定","3.4","88","2018","建設業、運送業、製造業、IT・Web、サービス業"
"cb-factor","シー・ビー・ファクター","中小企業の資金繰りを支援するファクタリング会社。","https://px.a8.net/svt/ejp?a8mat=CBFACTOR","2社間・3社間","3","15","300000","50000000","1","TRUE","即日入金可能、オンライン対応、個人事業主OK、全国対応、柔軟な審査","対応が迅速、審査が柔軟、全国対応","知名度がやや低い、手数料は個別査定","3.4","89","2018","建設業、運送業、製造業、IT・Web、サービス業"
"cool-services","COOL SERVICES","オンライン完結のファクタリングサービス。","https://px.a8.net/svt/ejp?a8mat=COOLSERVICES","2社間・3社間","2","12","300000","50000000","1","TRUE","即日入金可能、オンライン対応、個人事業主OK、全国対応、柔軟な審査","対応が迅速、審査が柔軟、全国対応","知名度がやや低い、手数料は個別査定","3.5","90","2018","建設業、運送業、製造業、IT・Web、サービス業"
"prosper-consulting","プロスパーコンサルティング","資金調達コンサルティング＆ファクタリング。経営支援も提供。","https://px.a8.net/svt/ejp?a8mat=PROSPERCONSULTING","2社間・3社間","3","15","300000","50000000","1","TRUE","コンサルティング付き、即日入金、全国対応、法人・個人OK、経営支援","対応が迅速、審査が柔軟、全国対応","知名度がやや低い、手数料は個別査定","3.5","91","2018","建設業、運送業、製造業、IT・Web、サービス業"
"mk-trust","mkトラストマネジメント","中小企業向けファクタリング。丁寧な対応が評判。","https://px.a8.net/svt/ejp?a8mat=MKTRUST","2社間・3社間","3","15","300000","50000000","1","TRUE","即日入金可能、オンライン対応、個人事業主OK、全国対応、柔軟な審査","対応が迅速、審査が柔軟、全国対応","知名度がやや低い、手数料は個別査定","3.4","92","2018","建設業、運送業、製造業、IT・Web、サービス業"
"besus","Besus","オンラインファクタリングサービス。スピード重視の資金調達。","https://px.a8.net/svt/ejp?a8mat=BESUS","2社間・3社間","2","15","300000","50000000","1","TRUE","即日入金可能、オンライン対応、個人事業主OK、全国対応、柔軟な審査","対応が迅速、審査が柔軟、全国対応","知名度がやや低い、手数料は個別査定","3.5","93","2018","建設業、運送業、製造業、IT・Web、サービス業"
"shukran","シュクラン","ファクタリング・資金調達サービス。柔軟な対応が特長。","https://px.a8.net/svt/ejp?a8mat=SHUKRAN","2社間・3社間","3","15","300000","50000000","1","TRUE","即日入金可能、オンライン対応、個人事業主OK、全国対応、柔軟な審査","対応が迅速、審査が柔軟、全国対応","知名度がやや低い、手数料は個別査定","3.4","94","2018","建設業、運送業、製造業、IT・Web、サービス業"
"alpharia","アルファリア","法人向けファクタリング。審査が柔軟で即日対応可能。","https://px.a8.net/svt/ejp?a8mat=ALPHARIA","2社間・3社間","3","15","300000","50000000","1","TRUE","即日入金可能、オンライン対応、個人事業主OK、全国対応、柔軟な審査","対応が迅速、審査が柔軟、全国対応","知名度がやや低い、手数料は個別査定","3.5","95","2018","建設業、運送業、製造業、IT・Web、サービス業"
"rise-factoring","Rise","ファクタリング・資金調達サービス。中小企業向け。","https://px.a8.net/svt/ejp?a8mat=RISEFACTORING","2社間・3社間","3","15","300000","50000000","1","TRUE","即日入金可能、オンライン対応、個人事業主OK、全国対応、柔軟な審査","対応が迅速、審査が柔軟、全国対応","知名度がやや低い、手数料は個別査定","3.4","96","2018","建設業、運送業、製造業、IT・Web、サービス業"
"kis-management","KISマネジメント","ファクタリング・事業資金調達サービス。","https://px.a8.net/svt/ejp?a8mat=KISMANAGEMENT","2社間・3社間","3","15","300000","50000000","1","TRUE","即日入金可能、オンライン対応、個人事業主OK、全国対応、柔軟な審査","対応が迅速、審査が柔軟、全国対応","知名度がやや低い、手数料は個別査定","3.4","97","2018","建設業、運送業、製造業、IT・Web、サービス業"
"sme-support","SMEサポート","中小企業向けファクタリング・資金調達サポート。","https://px.a8.net/svt/ejp?a8mat=SMESUPPORT","2社間・3社間","3","15","300000","50000000","1","TRUE","即日入金可能、オンライン対応、個人事業主OK、全国対応、柔軟な審査","対応が迅速、審査が柔軟、全国対応","知名度がやや低い、手数料は個別査定","3.4","98","2018","建設業、運送業、製造業、IT・Web、サービス業"
"sts-factoring","STS","ファクタリングサービス。法人・個人事業主対応。","https://px.a8.net/svt/ejp?a8mat=STSFACTORING","2社間・3社間","3","15","300000","50000000","1","TRUE","即日入金可能、オンライン対応、個人事業主OK、全国対応、柔軟な審査","対応が迅速、審査が柔軟、全国対応","知名度がやや低い、手数料は個別査定","3.4","99","2018","建設業、運送業、製造業、IT・Web、サービス業"
"owl-keizai","アウル経済","経済情報＆ファクタリングサービス。中小企業向け。","https://px.a8.net/svt/ejp?a8mat=OWLKEIZAI","2社間・3社間","3","15","300000","50000000","1","TRUE","即日入金可能、オンライン対応、個人事業主OK、全国対応、柔軟な審査","対応が迅速、審査が柔軟、全国対応","知名度がやや低い、手数料は個別査定","3.4","100","2018","建設業、運送業、製造業、IT・Web、サービス業"
"fk-management","エフケーマネージメント","ファクタリング・資金調達の総合サービス。","https://px.a8.net/svt/ejp?a8mat=FKMANAGEMENT","2社間・3社間","3","15","300000","50000000","1","TRUE","即日入金可能、オンライン対応、個人事業主OK、全国対応、柔軟な審査","対応が迅速、審査が柔軟、全国対応","知名度がやや低い、手数料は個別査定","3.4","101","2018","建設業、運送業、製造業、IT・Web、サービス業"
"techpay","テックペイ","テクノロジーを活用したファクタリングサービス。","https://px.a8.net/svt/ejp?a8mat=TECHPAY","2社間・3社間","2","12","300000","50000000","1","TRUE","テクノロジー活用、オンライン完結、即日入金、個人事業主OK、全国対応","対応が迅速、審査が柔軟、全国対応","知名度がやや低い、手数料は個別査定","3.5","102","2018","建設業、運送業、製造業、IT・Web、サービス業"
"next-style","ネクストスタイル","ファクタリングサービス。柔軟な審査と迅速な対応。","https://px.a8.net/svt/ejp?a8mat=NEXTSTYLE","2社間・3社間","3","15","300000","50000000","1","TRUE","即日入金可能、オンライン対応、個人事業主OK、全国対応、柔軟な審査","対応が迅速、審査が柔軟、全国対応","知名度がやや低い、手数料は個別査定","3.4","103","2018","建設業、運送業、製造業、IT・Web、サービス業"
"crayfish","クレイリッシュ","手形割引・ファクタリングサービス。金融ノウハウを活かした対応。","https://px.a8.net/svt/ejp?a8mat=CRAYFISH","2社間・3社間","3","15","300000","50000000","1","TRUE","手形割引対応、ファクタリング、即日入金、全国対応、柔軟な審査","対応が迅速、審査が柔軟、全国対応","知名度がやや低い、手数料は個別査定","3.5","104","2018","建設業、運送業、製造業、IT・Web、サービス業"
"factors","ファクターズ","ファクタリング専門会社。法人向け売掛金買取。","https://px.a8.net/svt/ejp?a8mat=FACTORS","2社間・3社間","3","15","300000","50000000","1","TRUE","即日入金可能、オンライン対応、個人事業主OK、全国対応、柔軟な審査","対応が迅速、審査が柔軟、全国対応","知名度がやや低い、手数料は個別査定","3.4","105","2018","建設業、運送業、製造業、IT・Web、サービス業"
"facnet","ファクネット","オンラインファクタリングサービス。手軽に資金調達。","https://px.a8.net/svt/ejp?a8mat=FACNET","2社間・3社間","2","12","300000","50000000","1","TRUE","即日入金可能、オンライン対応、個人事業主OK、全国対応、柔軟な審査","対応が迅速、審査が柔軟、全国対応","知名度がやや低い、手数料は個別査定","3.5","106","2018","建設業、運送業、製造業、IT・Web、サービス業"
"fortune-partners","フォーチューンパートナーズ","ファクタリング・資金調達のコンサルティング。","https://px.a8.net/svt/ejp?a8mat=FORTUNEPARTNERS","2社間・3社間","3","15","300000","50000000","1","TRUE","即日入金可能、オンライン対応、個人事業主OK、全国対応、柔軟な審査","対応が迅速、審査が柔軟、全国対応","知名度がやや低い、手数料は個別査定","3.4","107","2018","建設業、運送業、製造業、IT・Web、サービス業"
"cs-planning","シーエスプランニング","ファクタリング・事業資金調達サポート。","https://px.a8.net/svt/ejp?a8mat=CSPLANNING","2社間・3社間","3","15","300000","50000000","1","TRUE","即日入金可能、オンライン対応、個人事業主OK、全国対応、柔軟な審査","対応が迅速、審査が柔軟、全国対応","知名度がやや低い、手数料は個別査定","3.4","108","2018","建設業、運送業、製造業、IT・Web、サービス業"
"shinki-corp","シンキコーポレーション","ファクタリングサービス。法人向け資金調達。","https://px.a8.net/svt/ejp?a8mat=SHINKICORP","2社間・3社間","3","15","300000","50000000","1","TRUE","即日入金可能、オンライン対応、個人事業主OK、全国対応、柔軟な審査","対応が迅速、審査が柔軟、全国対応","知名度がやや低い、手数料は個別査定","3.4","109","2018","建設業、運送業、製造業、IT・Web、サービス業"
"transaction-finance","トランザクションファイナンス","取引金融のプロフェッショナル。ファクタリング対応。","https://px.a8.net/svt/ejp?a8mat=TRANSACTIONFINANCE","2社間・3社間","2","10","300000","50000000","1","TRUE","即日入金可能、オンライン対応、個人事業主OK、全国対応、柔軟な審査","対応が迅速、審査が柔軟、全国対応","知名度がやや低い、手数料は個別査定","3.5","110","2018","建設業、運送業、製造業、IT・Web、サービス業"
"factor-com","ファクター.com","オンラインファクタリングサービス。","https://px.a8.net/svt/ejp?a8mat=FACTORCOM","2社間・3社間","2","12","300000","50000000","1","TRUE","即日入金可能、オンライン対応、個人事業主OK、全国対応、柔軟な審査","対応が迅速、審査が柔軟、全国対応","知名度がやや低い、手数料は個別査定","3.5","111","2018","建設業、運送業、製造業、IT・Web、サービス業"
"factoring-gold","ファクタリングゴールド","ファクタリング専門。ゴールドクラスのサービス品質。","https://px.a8.net/svt/ejp?a8mat=FACTORINGGOLD","2社間・3社間","3","15","300000","50000000","1","TRUE","即日入金可能、オンライン対応、個人事業主OK、全国対応、柔軟な審査","対応が迅速、審査が柔軟、全国対応","知名度がやや低い、手数料は個別査定","3.4","112","2018","建設業、運送業、製造業、IT・Web、サービス業"
"factoring-pro","ファクタリングプロ","プロフェッショナルなファクタリングサービス。法人向け。","https://px.a8.net/svt/ejp?a8mat=FACTORINGPRO","2社間・3社間","2","15","300000","50000000","1","TRUE","即日入金可能、オンライン対応、個人事業主OK、全国対応、柔軟な審査","対応が迅速、審査が柔軟、全国対応","知名度がやや低い、手数料は個別査定","3.5","113","2018","建設業、運送業、製造業、IT・Web、サービス業"
"rising-investment","ライジングインベストメント","投資＆ファクタリングサービス。資金調達をサポート。","https://px.a8.net/svt/ejp?a8mat=RISINGINVESTMENT","2社間・3社間","3","15","300000","50000000","1","TRUE","即日入金可能、オンライン対応、個人事業主OK、全国対応、柔軟な審査","対応が迅速、審査が柔軟、全国対応","知名度がやや低い、手数料は個別査定","3.4","114","2018","建設業、運送業、製造業、IT・Web、サービス業"
"line-profect","ラインプロフェクト","ファクタリング・資金調達サービス。","https://px.a8.net/svt/ejp?a8mat=LINEPROFECT","2社間・3社間","3","15","300000","50000000","1","TRUE","即日入金可能、オンライン対応、個人事業主OK、全国対応、柔軟な審査","対応が迅速、審査が柔軟、全国対応","知名度がやや低い、手数料は個別査定","3.4","115","2018","建設業、運送業、製造業、IT・Web、サービス業"
"link-japan","リンクジャパン","ファクタリング・事業資金調達。法人向け。","https://px.a8.net/svt/ejp?a8mat=LINKJAPAN","2社間・3社間","3","15","300000","50000000","1","TRUE","即日入金可能、オンライン対応、個人事業主OK、全国対応、柔軟な審査","対応が迅速、審査が柔軟、全国対応","知名度がやや低い、手数料は個別査定","3.4","116","2018","建設業、運送業、製造業、IT・Web、サービス業"
"whatever","ワットエバー","ファクタリングサービス。中小企業の資金繰りをサポート。","https://px.a8.net/svt/ejp?a8mat=WHATEVER","2社間・3社間","3","15","300000","50000000","1","TRUE","即日入金可能、オンライン対応、個人事業主OK、全国対応、柔軟な審査","対応が迅速、審査が柔軟、全国対応","知名度がやや低い、手数料は個別査定","3.4","117","2018","建設業、運送業、製造業、IT・Web、サービス業"
"zaimu-saisei","財務再生支援センター","財務再生＆ファクタリングサービス。経営改善をサポート。","https://px.a8.net/svt/ejp?a8mat=ZAIMUSAISEI","2社間・3社間","3","15","300000","50000000","1","TRUE","財務再生支援、ファクタリング、経営改善、全国対応、コンサルティング","対応が迅速、審査が柔軟、全国対応","知名度がやや低い、手数料は個別査定","3.5","118","2018","建設業、運送業、製造業、IT・Web、サービス業"
"sanko-factoring","三鉱","ファクタリングサービス。法人向け資金調達。","https://px.a8.net/svt/ejp?a8mat=SANKOFACTORING","2社間・3社間","3","15","300000","50000000","1","TRUE","即日入金可能、オンライン対応、個人事業主OK、全国対応、柔軟な審査","対応が迅速、審査が柔軟、全国対応","知名度がやや低い、手数料は個別査定","3.4","119","2018","建設業、運送業、製造業、IT・Web、サービス業"
"mita-securities","三田証券","証券会社系ファクタリング。金融のプロが対応。","https://px.a8.net/svt/ejp?a8mat=MITASECURITIES","2社間・3社間","2","10","300000","50000000","1","TRUE","証券会社運営、ファクタリング、法人向け、金融のプロ、全国対応","対応が迅速、審査が柔軟、全国対応","知名度がやや低い、手数料は個別査定","3.5","120","2018","建設業、運送業、製造業、IT・Web、サービス業"
"toshin-shoji","東信商事","ファクタリング・商業金融サービス。","https://px.a8.net/svt/ejp?a8mat=TOSHINSHOJI","2社間・3社間","3","15","300000","50000000","1","TRUE","即日入金可能、オンライン対応、個人事業主OK、全国対応、柔軟な審査","対応が迅速、審査が柔軟、全国対応","知名度がやや低い、手数料は個別査定","3.4","121","2018","建設業、運送業、製造業、IT・Web、サービス業"
"enable-factoring","エネイブル","ファクタリング・事業資金サービス。","https://px.a8.net/svt/ejp?a8mat=ENABLEFACTORING","2社間・3社間","3","15","300000","50000000","1","TRUE","即日入金可能、オンライン対応、個人事業主OK、全国対応、柔軟な審査","対応が迅速、審査が柔軟、全国対応","知名度がやや低い、手数料は個別査定","3.4","122","2018","建設業、運送業、製造業、IT・Web、サービス業"
"elnest","エルネスト","ファクタリングサービス。柔軟な審査と迅速な対応。","https://px.a8.net/svt/ejp?a8mat=ELNEST","2社間・3社間","3","15","300000","50000000","1","TRUE","即日入金可能、オンライン対応、個人事業主OK、全国対応、柔軟な審査","対応が迅速、審査が柔軟、全国対応","知名度がやや低い、手数料は個別査定","3.4","123","2018","建設業、運送業、製造業、IT・Web、サービス業"
"axia-plus","アクシアプラス","ファクタリング・資金調達サポート。","https://px.a8.net/svt/ejp?a8mat=AXIAPLUS","2社間・3社間","3","15","300000","50000000","1","TRUE","即日入金可能、オンライン対応、個人事業主OK、全国対応、柔軟な審査","対応が迅速、審査が柔軟、全国対応","知名度がやや低い、手数料は個別査定","3.4","124","2018","建設業、運送業、製造業、IT・Web、サービス業"
"archier","アルシエ","ファクタリングサービス。法人向け。","https://px.a8.net/svt/ejp?a8mat=ARCHIER","2社間・3社間","3","15","300000","50000000","1","TRUE","即日入金可能、オンライン対応、個人事業主OK、全国対応、柔軟な審査","対応が迅速、審査が柔軟、全国対応","知名度がやや低い、手数料は個別査定","3.4","125","2018","建設業、運送業、製造業、IT・Web、サービス業"
"third-eye","サードアイ","ファクタリング・資金調達コンサルティング。","https://px.a8.net/svt/ejp?a8mat=THIRDEYE","2社間・3社間","3","15","300000","50000000","1","TRUE","即日入金可能、オンライン対応、個人事業主OK、全国対応、柔軟な審査","対応が迅速、審査が柔軟、全国対応","知名度がやや低い、手数料は個別査定","3.4","126","2018","建設業、運送業、製造業、IT・Web、サービス業"
"dmc-factoring","DMC","ファクタリング・事業資金サービス。","https://px.a8.net/svt/ejp?a8mat=DMCFACTORING","2社間・3社間","3","15","300000","50000000","1","TRUE","即日入金可能、オンライン対応、個人事業主OK、全国対応、柔軟な審査","対応が迅速、審査が柔軟、全国対応","知名度がやや低い、手数料は個別査定","3.4","127","2018","建設業、運送業、製造業、IT・Web、サービス業"
"nihon-planner","日本プランナー","ファクタリング・資金調達サポート。","https://px.a8.net/svt/ejp?a8mat=NIHONPLANNER","2社間・3社間","3","15","300000","50000000","1","TRUE","即日入金可能、オンライン対応、個人事業主OK、全国対応、柔軟な審査","対応が迅速、審査が柔軟、全国対応","知名度がやや低い、手数料は個別査定","3.4","128","2018","建設業、運送業、製造業、IT・Web、サービス業"
"yamaki-shoji","山輝商事","ファクタリング・商事金融サービス。","https://px.a8.net/svt/ejp?a8mat=YAMAKISHOJI","2社間・3社間","3","15","300000","50000000","1","TRUE","即日入金可能、オンライン対応、個人事業主OK、全国対応、柔軟な審査","対応が迅速、審査が柔軟、全国対応","知名度がやや低い、手数料は個別査定","3.4","129","2018","建設業、運送業、製造業、IT・Web、サービス業"
"animo","ANIMO","ファクタリングサービス。","https://px.a8.net/svt/ejp?a8mat=ANIMO","2社間・3社間","3","15","300000","50000000","1","TRUE","即日入金可能、オンライン対応、個人事業主OK、全国対応、柔軟な審査","対応が迅速、審査が柔軟、全国対応","知名度がやや低い、手数料は個別査定","3.4","130","2018","建設業、運送業、製造業、IT・Web、サービス業"
"mainavy-factoring","マイナビファクタリング","マイナビ関連のファクタリングサービス。","https://px.a8.net/svt/ejp?a8mat=MAINAVYFACTORING","2社間・3社間","3","15","300000","50000000","1","TRUE","即日入金可能、オンライン対応、個人事業主OK、全国対応、柔軟な審査","対応が迅速、審査が柔軟、全国対応","知名度がやや低い、手数料は個別査定","3.4","131","2018","建設業、運送業、製造業、IT・Web、サービス業"
"goodplus","GoodPlus（グッドプラス）","土日祝も対応。最短90分で入金。手数料5%～15%。他社比較で1%以上安くする保証付き。","https://px.a8.net/svt/ejp?a8mat=GOODPLUS","2社間","5","15","100000","50000000","1","TRUE","土日祝も対応、最短90分入金、他社より1%安い保証、審査通過率90%、オンライン完結","土日祝日も営業、最短90分のスピード、他社見積より安くする保証","手数料下限が5%とやや高め、法人のみ対応の場合あり","4.1","132","2020","建設業、運送業、製造業、IT・Web、サービス業"
"kkt","KKTファクタリング","累計買取額100億円超。手数料2社間1%～、3社間0.5%～の業界最安水準。法人向け。","https://px.a8.net/svt/ejp?a8mat=KKT","2社間・3社間","0.5","15","300000","100000000","1","TRUE","手数料0.5%〜、累計100億円超、リピート率89.6%、顧客満足度92.3%、法人向け","業界最安水準の手数料、高いリピート率、幅広い業種に対応","法人のみ対応、土日祝は休み","4","133","2018","建設業、運送業、製造業、飲食業、卸売業"
